{
    "$schema": "./hwd_analysis.schema.json",
    "dynamic_on": true,
    "dynamic_truncated": false,
    "dynamic_timesteps": 500,
    "input_location": "401",
    "dynamic_integrator": "Newmark",
    "damping_type": "rayleigh",
    "damping_modes": "1,2",
    "damping_ratios": "0.015,0.015",
    "rayleigh_zerolength_on": true,
    "dynamic_scale_factor": 1.0,
    "record_zip": "Records/58658_003_20210628_18.29.26.P_SanLo.zip"
}